Lagomar_Planes_Linea,"En Lagomar tenemos planes creados para todos los gustos y presupuestos, haz clic en el siguiente enlace http://bit.ly/2VesQOI selecciona PLANES y conoce los detalles y costos de cada uno
¿Quieres que un asesor te acompañe en  la elección de la mejor oferta para ti?"
Lagomar_Planes_Fuera_Linea,"En Lagomar tenemos planes creados para todos los gustos y presupuestos, haz clic en el siguiente enlace http://bit.ly/2VesQOI selecciona PLANES y conoce los detalles y costos de cada uno."
Lagomar_Servicios,"Servicios Lagomar: 4 piscinas, mini golf, canchas de tenis, cancha de vóley playa, bicicletas estáticas, salón de juegos, tarabita, SPA, playa artificial, bolera, lanchas, campo de futbol, descubre más de cada uno de estos espacios aquí http://bit.ly/2YHRgSR"
Comida_Lagosol,"En el hotel Lagosol puedes encontrar platos a la carta, restaurante autoservicio con diferentes alternativas para el desayuno, almuerzo o cena y puntos de venta con bebidas frías, helados y entre otros alimentos refrescantes. Los horarios para realizar el consumo de los alimentos en el restaurante serán por grupos: Grupo1: Desayuno de 8 a 9 a.m., almuerzo de 12 a 1 p.m., y cena de 7 a 8p.m. "
Comida_Lagomar,"En el hotel Lagomar encontrarás servicio de buffet asistido por colaboradores, manteniendo estándares de higiene, es indispensable tu apoyo acatando las indicaciones y horarios que le suministrará nuestro colaborador de recibo o bienvenida. En el check in, podrás elegir una de las tres opciones de horarios de la alimentación."
Transfer_Reserva_En_Horario,"gwi_transfer >>> Te transfiero con un agente para la cotización y disponibilidad."
Transfer_Reserva_Fuera_De_Horario,"Agradecemos tu interés para disfrutar en uno de nuestros hoteles, en estos momentos no contamos con asesores en línea, pero dentro de 24 horas uno de nuestros asesores se contactará contigo con el fin de tomar tu reserva."
Transfer_Reserva_Fuera_De_Horario_DisponibilidadTarifas,"En estos momentos no contamos con asesores en línea, dentro de las próximas 24 horas uno de nuestros asesores especializados en turismo te contactará con el fin de atender tu solicitud."
Lagomar_No_Pasadia,"El servicio de Pasadía se presta únicamente en nuesro hotel Lagosol. En Lagomar contamos sólo con servicio de hospedaje."
Lagomar_ascensores,"En Lagomar contamos con ascensores para aquellas personas con alguna limitación física."
Pasadia_Adquirir_Boletas,"Si tú y tu grupo familiar se encuentran afiliados a nuestra caja de compensación, puedes adquirir el servicio de pasadía por nuestro portal transaccional http://bit.ly/2WD0fTk debes autenticarte con tu usuario y clave, podrás realizar la compra con tarjeta débito o crédito. De lo contrario si deseas pagar en efectivo puedes acercarte a una de nuestras sedes autorizadas, conocelas aquí http://bit.ly/2FMiRcM "
tour_virtual,"Anímate a conocer cada una de las instalaciones de nuestros hoteles accede a http://bit.ly/2YHRgSR para conocer de Lagomar o para Lagosol ingresa aquí http://bit.ly/2OJGgja en cada una de estas páginas encontraras un tour virtual para que interactúes con los espacios de estos maravillosos hoteles. ¡Vive en Digital!"
Plan_cumple,"Compensar siempre piensa en ti y en brindarte más beneficios, en el mes de tu cumpleaños viaja a uno de nuestros hoteles con un gran descuento en tu reserva que no puedes dejar pasar, conoce el detalle en: Lagomar http://bit.ly/2OFzufy y Lagosol http://bit.ly/2tMDvro "
Pagos_Tarjeta_Compensar,"Claro que puedes pagar con tu Tarjeta Compensar, para esto puedes dirigirte a alguna de nuestras sedes de Caja, conoce la más cercana en http://bit.ly/2ODa4Pt y visítanos!"
Pasadia_No_Afiliados,"Claro que si, nuestros usuarios no afiliados, tambien pueden disfrutar nuestros servicios, la taria de pasadía es adultos $44.800 y niños $30.900"
Cambio_Fecha_Pasadia,"Si deseas realizar cambios de fecha de pasadía en Lagosol, debes acercarte a una de las taquillas en las sedes de Caja de Compensación, presentar documento de identificación, factura(s) original(es) y preferiblemente documento escrito solicitando el cambio."
Reservar_Pagar_Cuotas,"En baja temporada puedes garantizar tu reserva realizando un abono del 50% y el excedente lo puedes pagar antes de la fecha de viaje. Si es temporada alta si es necesario el pago total o podrias solicitar un crédito Compensar."
Subsidio_Monetario,"Realiza tu reserva en el Hotel Lagosol pagando con tu cuota del Subsidio Monetario podrás acceder a una noche de alojamiento por tan solo $33.400 por persona (Aplica para categoría A y B). Conoce las condiciones y restricciones de este beneficio en http://bit.ly/2GHNMbc Para realizar tu reserva y pago por favor acercate a una de nuestras sedes con tu Tarjeta Compensar."
Pasadia_Servicio_Domestico,"El servicio de pasadía en Lagosol para empleados de servicio incluye lo siguiente: Ingreso al parque, piscinas, gorro de baño, vestidores, almuerzo tipo menú, refrigerio, recreación dirigida, lago con bicicletas acuáticas, acceso al salón de juegos, senderos ecológicos, parqueadero transporte ida y regreso
Ten en cuenta que la hora de salida a Lagosol es a las 5:30a.m. y la hora de regreso a Bogotá es a las 5:00p.m. No se garantiza la prestación del servicio si te presentas después de este horario. Indispensable presentar documento de identificación. Tarifa no reembolsable. No aplica cambio de fecha.
Para realizar tu reserva y pago por favor acercate a una de nuestras sedes con tu Tarjeta Compensar."
Pasadia_Servicio_Domestico_Info,"Si eres empleado(a) de servicio doméstico Categoría A (es decir que recibes hasta 2 salarios mínimos legales vigentes), podrás disfrutar de pasadías en Lagosol por solo $2.000 por persona. Para acceder a este servicio acércate a una de las taquillas en las sedes donde se prestan servicios de caja de compensación, presenta el documento de identidad del cotizante o beneficiario y realiza el pago correspondiente.
La venta está sujeta al calendario de programación y cupos disponibles al momento de la solicitud de compra del servicio."
Agua_Caliente,"Así es, en nuestros hoteles Lagomar y Lagosol hay agua caliente."
Disponibilidad_Pasadia,"Puedes conocer la disponibilidad o comprar tu pasadía en Lagosol a través de nuestro portal transaccional, ingresa aquí http://bit.ly/3c2QJS1 y conoce el paso a paso o puedes acercarte a una de nuestras sedes autorizadas, conócelas aquí http://bit.ly/3a4PGzo"
CoronaVirus,"Informamos que, comprometidos con el bienestar de nuestros usuarios, y acogiendo los lineamientos establecidos por el Ministerio de Salud y la Secretaría de Salud Distrital, hemos implementado y fortalecido todas las medidas preventivas y protocolos correspondientes ante la emergencia sanitaria: rutinas y medidas de aseo, limpieza, desinfección y asepsia en nuestras instalaciones.
Te invitamos a ingresar aquí https://bit.ly/3avRXmF y consultar las novedades en la prestación de los servicios "
PlanesTransferencia,"gwi_transfer >>> Te estoy transfiriendo a un asesor, el te brindará toda la información acerca de los diferentes planes, conoce el que más se ajusta a tu necesidad y disfruta de una experiencia inolvidable!"
PlanesGeneral,"gwi_transfer >>> Te estoy transfiriendo a un asesor, el te brindará toda la información acerca de los diferentes planes, conoce el que más se ajusta a tu necesidad y disfruta de una experiencia inolvidable!"
PlanesFueraHorario,"En Lagomar tenemos planes creados para todos los gustos y presupuestos, haz clic en el siguiente enlace http://bit.ly/2VesQOI selecciona PLANES y conoce los detalles y costos de cada uno.
En Lagosol tenemos planes creados para todos los gustos y presupuestos, haz clic en el siguiente enlace http://bit.ly/2Uxs95G selecciona PLANES y conoce los detalles y costos de cada uno."
CoronaVirus_2,"Teniendo en cuenta el decreto 531 expedido por el gobierno nacional para el cumpimiento del aislamiento preventivo obligarorio, nuestros hoteles Lagomar y Lagosol se encuentran cerrados. Si tu reserva fue creada para disfrutar en estos días de cuarentena, puedes realizar la modificación o solicitar la devolución del 100%. ¿Quieres realizar esta modificación o devolución?"
CoronaVirus_3,"Puedes realizar reservas en nuestros hoteles, recomendamos que estas sean despues del 1 de septiembre, mientras, el gobierno nacional no extienda las reglamentaciones."
CoronaVirus_4,"Teniendo en cuenta el decreto 531 expedido por el gobierno nacional para el cumpimiento del aislamiento preventivo obligarorio, nuestros hoteles Lagomar y Lagosol se encuentran cerrados. Una vez se levante este decreto, se informará a todos nuestros usuarios a través de nuestra página web."
Hoteles_Reapertura,"Aún no se ha establecido una fecha de apertura ya que nos encontramos sujetos a las decisiones del gobierno frente al restablecimiento de actividades."
Hoteles_MedidasHigiene,"Desde Compensar ya se estamos creando los protocolos de bioseguridad correspondientes, sin embargo, estamos sujetos a las decisiones del gobierno frente a la fecha para el restablecimiento de actividades turísticas y hoteleras."
Hoteles_TarifaFinAño,"Por el momento contamos con tarifas hasta el 11 de diciembre del 2020, para fechas especiales debe estar atento a novedades en nuestra página web."
Aplazar_Reserva,"Por el momento no es posible ya que sólo contamos con tarifas hasta el 11 de diciembre"